ID,name,code,description,isActive
550e8400-e29b-41d4-a716-446655440001,Information Technology,IT,Technology and Development Department,true
550e8400-e29b-41d4-a716-446655440002,Human Resources,HR,Human Resources and Administration,true
550e8400-e29b-41d4-a716-446655440003,Finance,FIN,Finance and Accounting Department,true
550e8400-e29b-41d4-a716-446655440004,Sales,SALES,Sales and Marketing Department,true
550e8400-e29b-41d4-a716-446655440005,Operations,OPS,Operations and Support Department,true 